{
  "schema_version": "langchao.prelaunch-structural-result.v1",
  "run_id": "prelaunch-structural-20261002T033857Z",
  "generated_at": "2026-10-02T03:38:57.058224+00:00",
  "repository_root": ".",
  "baseline": {
    "commit": "d0bda5f1e3335aad5b48c8a66d20a0774c7b4077",
    "dirty": true
  },
  "runner": {
    "path": "runtime/audit/run_prelaunch_structural_evidence.py",
    "python": "3.13.1",
    "command": [
      "C:\\Python313\\python.exe",
      "runtime/audit/run_prelaunch_structural_evidence.py",
      "--plan",
      "runtime/audit/prelaunch_structural_scenarios_v1.json",
      "--output",
      "runtime/audit/evidence/prelaunch_structural_latest.json"
    ],
    "timeout_seconds": 120
  },
  "summary": {
    "total": 10,
    "passed": 6,
    "failed": 0,
    "blocked": 4,
    "status": "passed_limited"
  },
  "results": [
    {
      "id": "T02",
      "title": "Capability plus real artifact witness",
      "status": "blocked",
      "component": "capability/artifact authenticity gate",
      "fault_injection": "Remove the hash-bound artifact while retaining the declared capability.",
      "pytest_nodes": [],
      "returncode": null,
      "duration_seconds": 0.0,
      "stdout": "",
      "stderr": "",
      "artifacts": [
        {
          "path": "runtime/audit/prelaunch_structural_scenarios_v1.json",
          "sha256": "69ff528ca8974e509a0400ed11f6c0bf75fb09e095c2584a0b2a5eafaa9f7d7e",
          "bytes": 6899
        }
      ],
      "blocker": "No candidate-level registry jointly validates an actual retrieval capability and a resolvable hash-bound artifact before claim/attempt. Capability leases and source refs are not an artifact witness.",
      "claim_limit": "No T evidence is claimed until the artifact-witness contract exists."
    },
    {
      "id": "T03",
      "title": "Shadow rehearsal is write-isolated",
      "status": "passed_limited",
      "component": "shadow scope and capability isolation",
      "fault_injection": "Select a shadow candidate whose simulated forecast is positive and verify all execution/learning counters remain zero.",
      "pytest_nodes": [
        "tests/test_prelaunch_structural_scenarios.py::test_t03_shadow_positive_rehearsal_has_zero_protected_writes"
      ],
      "returncode": 0,
      "duration_seconds": 2.942123,
      "stdout": ".                                                                        [100%]\n",
      "stderr": "",
      "artifacts": [
        {
          "path": "runtime/audit/prelaunch_structural_scenarios_v1.json",
          "sha256": "69ff528ca8974e509a0400ed11f6c0bf75fb09e095c2584a0b2a5eafaa9f7d7e",
          "bytes": 6899
        },
        {
          "path": "runtime/tests/test_prelaunch_structural_scenarios.py",
          "sha256": "7315aa211494dadab4c7b7b2b26f2baacca2c7841d84c80f43ed9511350ea13f",
          "bytes": 13199
        }
      ],
      "blocker": null,
      "claim_limit": "Proves the current shadow coordinator write surface and counters only; it does not prove every future prediction store is isolated."
    },
    {
      "id": "T05",
      "title": "Cross-scope private material is rejected",
      "status": "passed_limited",
      "component": "scope-bound source/proposal resolver",
      "fault_injection": "Substitute a source from user B into user A's proposal despite matching topic keywords.",
      "pytest_nodes": [
        "tests/test_prelaunch_structural_scenarios.py::test_t05_scope_isolation_rejects_cross_user_source"
      ],
      "returncode": 0,
      "duration_seconds": 2.971301,
      "stdout": ".                                                                        [100%]\n",
      "stderr": "",
      "artifacts": [
        {
          "path": "runtime/audit/prelaunch_structural_scenarios_v1.json",
          "sha256": "69ff528ca8974e509a0400ed11f6c0bf75fb09e095c2584a0b2a5eafaa9f7d7e",
          "bytes": 6899
        },
        {
          "path": "runtime/tests/test_prelaunch_structural_scenarios.py",
          "sha256": "7315aa211494dadab4c7b7b2b26f2baacca2c7841d84c80f43ed9511350ea13f",
          "bytes": 13199
        }
      ],
      "blocker": null,
      "claim_limit": "Proves DTO/build scope isolation at the named entrypoint, not every future retrieval query."
    },
    {
      "id": "T08",
      "title": "Duplicate delivery ACK is exactly once",
      "status": "passed_limited",
      "component": "live settlement and duplicate ACK handling",
      "fault_injection": "Replay the identical successful terminal acknowledgement three times.",
      "pytest_nodes": [
        "tests/test_prelaunch_structural_scenarios.py::test_t08_duplicate_ack_settles_delivery_once_only"
      ],
      "returncode": 0,
      "duration_seconds": 2.884943,
      "stdout": ".                                                                        [100%]\n",
      "stderr": "",
      "artifacts": [
        {
          "path": "runtime/audit/prelaunch_structural_scenarios_v1.json",
          "sha256": "69ff528ca8974e509a0400ed11f6c0bf75fb09e095c2584a0b2a5eafaa9f7d7e",
          "bytes": 6899
        },
        {
          "path": "runtime/tests/test_prelaunch_structural_scenarios.py",
          "sha256": "7315aa211494dadab4c7b7b2b26f2baacca2c7841d84c80f43ed9511350ea13f",
          "bytes": 13199
        }
      ],
      "blocker": null,
      "claim_limit": "Proves internal live-commit settlement idempotency, not external platform exactly-once delivery."
    },
    {
      "id": "T10",
      "title": "Partial observation window is censored",
      "status": "passed_limited",
      "component": "reply-label censored-window settlement",
      "fault_injection": "End a six-hour observation after two hours with no reply.",
      "pytest_nodes": [
        "tests/test_prelaunch_structural_scenarios.py::test_t10_censored_window_never_becomes_negative"
      ],
      "returncode": 0,
      "duration_seconds": 2.80324,
      "stdout": ".                                                                        [100%]\n",
      "stderr": "",
      "artifacts": [
        {
          "path": "runtime/audit/prelaunch_structural_scenarios_v1.json",
          "sha256": "69ff528ca8974e509a0400ed11f6c0bf75fb09e095c2584a0b2a5eafaa9f7d7e",
          "bytes": 6899
        },
        {
          "path": "runtime/tests/test_prelaunch_structural_scenarios.py",
          "sha256": "7315aa211494dadab4c7b7b2b26f2baacca2c7841d84c80f43ed9511350ea13f",
          "bytes": 13199
        }
      ],
      "blocker": null,
      "claim_limit": "Proves the pure label settlement contract; no training repository integration is inferred."
    },
    {
      "id": "T12",
      "title": "Permission revoke prevents stale dispatch",
      "status": "blocked",
      "component": "permission revoke/new-round/no-backlog lifecycle",
      "fault_injection": "Revoke permission after high readiness, then re-allow and check no old decision is dispatched.",
      "pytest_nodes": [],
      "returncode": null,
      "duration_seconds": 0.0,
      "stdout": "",
      "stderr": "",
      "artifacts": [
        {
          "path": "runtime/audit/prelaunch_structural_scenarios_v1.json",
          "sha256": "69ff528ca8974e509a0400ed11f6c0bf75fb09e095c2584a0b2a5eafaa9f7d7e",
          "bytes": 6899
        }
      ],
      "blocker": "No single Langchao lifecycle API currently connects readiness, permission_version, claim/outbox creation, revocation, re-enable, and stale-decision invalidation. Legacy pre-send boundary tests cannot prove the no-backlog contract.",
      "claim_limit": "No T evidence is claimed for the requested full lifecycle."
    },
    {
      "id": "T14",
      "title": "Failed and unknown send are not user rejection",
      "status": "passed_limited",
      "component": "terminal send failure/unknown reconciliation",
      "fault_injection": "Inject a terminal send failure and a missing/unknown acknowledgement.",
      "pytest_nodes": [
        "tests/test_prelaunch_structural_scenarios.py::test_t14_send_failure_censors_delivery_without_user_rejection",
        "tests/test_prelaunch_structural_scenarios.py::test_t14_unknown_ack_remains_pending_without_second_commit"
      ],
      "returncode": 0,
      "duration_seconds": 2.892996,
      "stdout": "..                                                                       [100%]\n",
      "stderr": "",
      "artifacts": [
        {
          "path": "runtime/audit/prelaunch_structural_scenarios_v1.json",
          "sha256": "69ff528ca8974e509a0400ed11f6c0bf75fb09e095c2584a0b2a5eafaa9f7d7e",
          "bytes": 6899
        },
        {
          "path": "runtime/tests/test_prelaunch_structural_scenarios.py",
          "sha256": "7315aa211494dadab4c7b7b2b26f2baacca2c7841d84c80f43ed9511350ea13f",
          "bytes": 13199
        }
      ],
      "blocker": null,
      "claim_limit": "Failure is terminally covered; unknown is evidenced only as a durable pending commit with no duplicate commit, not as a complete reconciliation policy."
    },
    {
      "id": "T15",
      "title": "Four no-send reasons share one taxonomy",
      "status": "blocked",
      "component": "cross-layer no-send reason taxonomy",
      "fault_injection": "Hold other inputs fixed while selecting no-candidate, competition defer, permission denial, or delivery failure.",
      "pytest_nodes": [],
      "returncode": null,
      "duration_seconds": 0.0,
      "stdout": "",
      "stderr": "",
      "artifacts": [
        {
          "path": "runtime/audit/prelaunch_structural_scenarios_v1.json",
          "sha256": "69ff528ca8974e509a0400ed11f6c0bf75fb09e095c2584a0b2a5eafaa9f7d7e",
          "bytes": 6899
        }
      ],
      "blocker": "The four reasons are emitted by different layers and representations; no first-class unified audit taxonomy/result object exists. Running four unrelated tests would be proxy evidence and is intentionally refused.",
      "claim_limit": "No unified-taxonomy T evidence is claimed."
    },
    {